,Backbone.JS," — JavaScript-библиотека, основанная на шаблоне проектирования Model-View-Presenter (MVP), предназначена для разработки веб-приложений с поддержкой RESTful JSON интерфейса. Backbone — очень лёгкая библиотека (упакованная и gzip-сжатая 6.3 Кб), но для работы необходима библиотека Underscore.js, а для поддержки REST API и работы с DOM элементами рекомендуется подключить jQuery-подобную библиотеку: jQuery или Zepto. ",,,,,,,,,,,,,,,,,,,,,,,,,,,
,Blog writing," является обсуждение или информационный сайт опубликован на World Wide Web , состоящей из дискретных входов ( ""сообщения""), как правило, отображаются в обратном хронологическом порядке (самый последний пост появляется первая).",,,,,,,,,,,,,,,,,,,,,,,,,,,
,Book writing,"является человеком, который использует написаны слова в различных стилях и техниках для передачи идей. Писатели производить различные формы литературного творчества и творчества, такие какроманы , рассказы , стихи , пьесы , киносценарии и очерки , а также различные утилитарные формы, такие какотчеты и новостных статей.",,,,,,,,,,,,,,,,,,,,,,,,,,,
,B2B," — термин, определяющий вид информационного и экономического взаимодействия, классифицированного по типу взаимодействующих субъектов, в данном случае это — юридические лица, которые работают не на конечного рядового потребителя, а на такие же компании, то есть на другой бизнес.",,,,,,,,,,,,,,,,,,,,,,,,,,,
,Banner Desing," психологическая оптическая иллюзия[источник не указан 604 дня], благодаря которой пользователь сайта не замечает рекламные блоки (баннеры) или объекты, похожие на них.",,,,,,,,,,,,,,,,,,,,,,,,,,,
,BGP, — динамический протокол маршрутизации.,,,,,,,,,,,,,,,,,,,,,,,,,,,
,Bas," является одной из форм представлен в Австралийском налоговом управлении всеми предприятиями, чтобы сообщить своих налоговых обязательств,.",,,,,,,,,,,,,,,,,,,,,,,,,,,
,Biostatistics,"является применение статистики к широкому кругу тем в биологии . Наука биостатистике охватывает проектирование биологическихэкспериментов , особенно в медицине , аптеки , сельского хозяйства и рыболовства ; сбор, обобщение и анализ данных из этих экспериментов; и интерпретация, и вывод из, результатов",,,,,,,,,,,,,,,,,,,,,,,,,,,
,Business Plans," — план, программа осуществления бизнес-операций, действий фирмы, содержащая сведения о фирме, товаре, его производстве, рынках сбыта,маркетинге, организации операций и их эффективности",,,,,,,,,,,,,,,,,,,,,,,,,,,
,Blackberry jde,"BlackBerry Java среда разработки (BlackBerry JDE) представляет собой полностью интегрированную среду разработки и моделирования инструмент для построения Java Platform, Micro Edition (ME) Java® приложений для основанных Java® смартфонов BlackBerry.",,,,,,,,,,,,,,,,,,,,,,,,,,,
,Bulk Marketing,"представляет собой стратегию охвата рынка, в котором фирма решает игнорировать различия сегментов рынка и апеллировать весь рынок с одним предложением или одной стратегии. [",,,,,,,,,,,,,,,,,,,,,,,,,,,
,Boonex Dolphin,"является социальная платформа сети, которая может быть использована для создания сообществ или знакомства сайты социальных сетей, основанных. Boonex Дельфин была вокруг в течение достаточно долгого времени и имеет довольно большой следующий пользователей. В этом BoonEx Дельфин Review, я собираюсь принять вас на экскурсию по бесплатной версии и обсудить некоторые из моих мыслей о продукте и его использовании.",,,,,,,,,,,,,,,,,,,,,,,,,,,
,BizTalk Server,"— программный продукт компании Microsoft, обеспечивающий возможность автоматизации и управления бизнес-процессами на внутрикорпоративном и межкорпоративном уровне. Используя BizTalk, организации могут создавать распределенные бизнес-процессы, интегрирующие различные приложения внутри предприятия, а также реализующие надежное и безопасное взаимодействие с партнерами организации через локальную сеть и интернет. BizTalkтакже позиционируется как Сервер приложений",,,,,,,,,,,,,,,,,,,,,,,,,,,
,Business Models, — концептуальное описание предпринимательской деятельности.,,,,,,,,,,,,,,,,,,,,,,,,,,,
,BGL,"BGL имеет третичный квалифицированный персонал поддержки, которые профессионально подготовленных для доставки эффективной и надежной поддержки клиентов - See more at: https://translate.googleusercontent.com/translate_c?depth=1&hl=ru&prev=search&rurl=translate.google.com.ua&sl=en&u=http://www.bglcorp.com/services/support&usg=ALkJrhgeaJGyuH_OGxu3tz9lr19888488w#sthash.6Ggb63Lu.dpuf",,,,,,,,,,,,,,,,,,,,,,,,,,,
,Bioinformatics,"является междисциплинарный поле, которое разрабатывает методы и программные средства для понимания биологических данных. В качестве междисциплинарной области науки, биоинформатика сочетает информатику , статистику , математику и инженерное анализировать и интерпретировать биологические данные.Биоинформатика была использована для в кремнии анализ биологических запросов с использованием математических и статистических методов.",,,,,,,,,,,,,,,,,,,,,,,,,,,
,Brochure," является информативным бумажный документ (часто также используется для рекламы), которые могут быть сложены в шаблон, брошюры или листовки . Брошюры рекламы кусочки основном используют для введения компанию или организацию и сообщить о продукции и / или услуг на целевую аудиторию",,,,,,,,,,,,,,,,,,,,,,,,,,,
,Bitrix Intrament,,,,,,,,,,,,,,,,,,,,,,,,,,,,
,Blog Comments,"это услуга, которая внешне принимает Коментарии пользователей блога или интернет-газетасообщений. Многие такие услуги позволяют пользователям входить в службу комментарий в блоге хостинга с использованиемсоциальной сети учетные профиля, такие как те из Facebook Connect , Yahoo! , Google , LinkedIn , Myspace и т.д. Такие услуги могут также оказывать влияние на экземпляры спама в комментариях , а предварительная регистрация с комментариями хозяев может быть единственным средством, с помощью которого делать замечания на многих блогах.",,,,,,,,,,,,,,,,,,,,,,,,,,,
,BPO Call Center,"— специализированная организация или выделенное подразделение в организации, занимающиеся обработкой обращений и информированием по голосовым каналам связи в интересах организации-заказчика или головной организации.",,,,,,,,,,,,,,,,,,,,,,,,,,,
,Brand Licensing,"означает аренду или лизинг нематериальных активов. Это процесс создания и управления контрактами между владельцем марки и компании или человека, который хочет использовать бренд в сочетании с продуктом, в течение согласованного периода времени, в течение согласованного территории. Лицензирование используется владельцев брендов, чтобы расширить товарный знак или символ на продуктах совершенно иной природы.",,,,,,,,,,,,,,,,,,,,,,,,,,,
,Brand Management,"— управление брендом со стороны владельцев и клиентов (в том числе потенциальных). Под управлением понимается процесс целенаправленного наблюдения и воздействия на объект: целевое изменение/целевой отказ от изменения объекта[1]. Цель — максимизация марочных активов, максимальное использование потенциала бренда ",,,,,,,,,,,,,,,,,,,,,,,,,,,
,Borland SilkTest," является инструментом для автоматизированной функции и регрессионного тестирования корпоративных приложений. [1] Он был первоначально разработан Segue Software , которая была приобретена Borland в 2006 году Borland приобрел Micro Focus International в 2009 году.",,,,,,,,,,,,,,,,,,,,,,,,,,,
,Business Writing,"Деловая переписка часто включает сотрудничество с другими, такими как при работе в команде. Как правило, члены команды собираются вместе в начале, в течение Фазы 1, для обмена идеями. На этапе 2, каждый член может работать отдельно, чтобы сделать некоторые письма. Как только это будет сделано, участники могут встретиться вновь для Фазы 3 пересмотреть этот документ в качестве команды.",,,,,,,,,,,,,,,,,,,,,,,,,,,
,Black Box Testing," — стратегия (метод) тестирования функционального поведения объекта (программы, системы) с точки зрения внешнего мира, при котором не используется знание о внутреннем устройстве тестируемого объекта. Под стратегией понимаются систематические методы отбора и создания тестов для тестового набора. Стратегия поведенческого теста исходит из технических требований и их спецификаций",,,,,,,,,,,,,,,,,,,,,,,,,,,
,Book cover desing," это искусство включения содержания, стиля , формат , дизайн , и последовательность различных компонентов книги в единое целое",,,,,,,,,,,,,,,,,,,,,,,,,,,
,Business Coaching,"— инструктирование, наставничество, тренировка, занятия с репетитором) — система профессиональных взаимоотношений между специалистом по развитию и росту бизнеса, а также повышение мотивации(коучем) и клиентом, выражающаяся в поддержке и сопровождении человека до получения им необходимого результата в соответствии с его потребностями.",,,,,,,,,,,,,,,,,,,,,,,,,,,
,Business analysis,"— дисциплина выявления деловых потребностей и нахождения решений деловых проблем. Решения часто включают компонент разработки систем, но могут также состоять из усовершенствования процессов, организационных изменений или стратегического планирования и разработки политики. Человека, который выполняет эту задачу, называют бизнес-аналитиком.",,,,,,,,,,,,,,,,,,,,,,,,,,,
,Box2D,"— компьютерная программа, свободный открытый физический движок. Box2D является физическим движком реального времени и предназначен для работы с двумерными физическими объектами. Движок разработан Эрином Катто (англ. Erin Catto), написан на языке программирования C++ и распространяется на условиях лицензии zlib.",,,,,,,,,,,,,,,,,,,,,,,,,,,
,Business valuation," является процессом, а набор процедур, используемых для оценки экономической ценности интерес владельца в бизнес. Оценка используется участниками финансового рынка, чтобы определить цену, которую они готовы платить или получать для осуществления продажи бизнеса. В дополнение к оценке цену продажи бизнеса, те же самые инструменты оценки часто используются бизнес оценщиков для разрешения споров, связанных с имуществом и подарочной налогообложения, развод судебного процесса, выделить бизнес покупную цену среди бизнес-активов, создать формулу для оценки стоимости Доля собственности партнеров для купли-продажи соглашений, и многих других коммерческих и правовых целей, таких как в акционеров тупик, развод судебных и конкурс недвижимости. [1]в некоторых случаях суд назначает судебно-бухгалтер как совместное эксперта делать дело оценка.",,,,,,,,,,,,,,,,,,,,,,,,,,,
,Business management," является студентом программа трех лет.Степень BBM предназначен для обучения студентов навыков, необходимых для выполнения роли лидеров в бизнесе и корпоративном мире.",,,,,,,,,,,,,,,,,,,,,,,,,,,
,Borland C++ Builder," разработанная фирмой Borland для создания программ на языках программирования Си и C++. Каждая версия среды включает компилятор, поддерживающий свой стандарт языка программирования. Первоначально среда программирования использовалась для создания программ под DOS, но с появлением и распространением Windows и Windows NT были предложены средства для разработки приложений для этих операционных систем.",,,,,,,,,,,,,,,,,,,,,,,,,,,
,Bank Reconciliation,"является процессом, который объясняет разницу между баланса банка, показанной на организациибанковского счета , информация о которых предоставляется банком, и соответствующая сумма показано на собственных [бухгалтерских] записей организации в конкретный момент времени",,,,,,,,,,,,,,,,,,,,,,,,,,,
,Building Estimation,"Блок оценки потенциала является физическое лицо, количественную оценку материалов , рабочей силы и оборудования, необходимых для завершениястроительства проекта. Строительство смет может касаться различных форм строительства из жилых помещений в хай-подъема и строительных работ. Сметчиковотличаются от строительных оценок в том, что сметчик является формально обучение и аккредитованные профессиональные (степень бакалавра или выше) в области оценки.",,,,,,,,,,,,,,,,,,,,,,,,,,,
,Box.net,"представляет собой интернет-файлообменник и управление контентом сервис для бизнеса. Компания приняла Freemium бизнес-модель, и обеспечивает до 10 ГБ бесплатного пространства для хранения личных счетов.",,,,,,,,,,,,,,,,,,,,,,,,,,,
,Belle Nuit Subtitler,"Программа обнаружить, редактировать и выводить субтитры для редактирования видео, DVD авторинга и цифрового кино. Переводчики могут обнаружить непосредственно с фильма QuickTime и переводить точно. Субтитры затем могут быть импортированы в Avid Media Composer, Avid Xpress, Avid DS и Final Cut Pro 7 для редактирования. Те же субтитры могут быть отправлены также Adobe Encore DVD, Apple DVD Studio Pro, Соник продюсер и Sonic Scenarist для авторинга. Субтитры также можно использовать для живого субтитров на Texas Instruments Цифровые кинопроекторы. Belle Nuit Subtitler освобождает видео редакторов из монотонной работы и от опечатку ошибок.",,,,,,,,,,,,,,,,,,,,,,,,,,,
,Business Development,"включает в себя ряд задач и процессов, как правило, направленных на разработку и реализацию возможностей роста внутри и между организациями. Это подмножество области бизнеса, коммерции и организационной теории. Развитие бизнеса является создание долгосрочной стоимости для организации от клиентов, рынки, и отношений",,,,,,,,,,,,,,,,,,,,,,,,,,,
,Microstation,"продукт для двумерных и трехмерных проектирования и черчения, разработанная и продаваемая Bentley Systems. Последние версии программного обеспечения выпускаются исключительно для операционных систем Microsoft Windows, но исторически MicroStation была доступна для платформ Macintosh и ряда Unix-подобных операционных систем. MicroStation является пакет платформы архитектурно-проектная программное обеспечение, разработанное Bentley Systems, Incorporated. Среди целого ряда вещей, он генерирует 2D / 3D векторные графические объекты и элементы.",,,,,,,,,,,,,,,,,,,,,,,,,,,
,Business mathematics,"математика, используемые коммерческими предприятиями, чтобы записать и управлять бизнес-операций. Коммерческие организации используют математику в бухгалтерский учет, управление запасами, маркетинг, прогнозирование продаж, и финансового анализа. Математика как правило, используется в коммерции включает элементарную арифметику, элементарную алгебру, статистики и теории вероятностей. Ведение дел можно сделать более эффективным в некоторых случаях использование более продвинутых математике, таких как исчисление, матрицы алгебры и линейного программирования.",,,,,,,,,,,,,,,,,,,,,,,,,,,
,Business card design,"являются карточки с бизнес информацию о компании или частного лица. Они являются общими в ходе официальных введений, как удобство и памяткой. Визитная карточка, как правило, включает в себя дающий наименование, компания или бизнес принадлежность (как правило, с логотипом) и контактную информацию, такую как адреса улиц, номер (а) телефона, номер факса, адреса электронной почты и веб-сайт. До появления электронной связи визитных карточек может также включать телекс детали.",,,,,,,,,,,,,,,,,,,,,,,,,,,
,BASH," — усовершенствованная и модернизированная вариация командной оболочки Bourne shell. Одна из наиболее популярных современных разновидностей командной оболочки UNIX. Особенно популярна в среде Linux, где она часто используется в качестве предустановленной командной оболочки.",,,,,,,,,,,,,,,,,,,,,,,,,,,
