,financial forecast,"Финансовый прогноз является оценкой будущих финансовых результатов для компании или страны (для фьючерсов и валютных рынках). Используя исторические внутренние данные бухгалтерского учета и продаж, в дополнение к внешнему рынку и экономических показателей, финансового прогноз догадка экономиста что произойдет с компанией в финансовом плане в течение определенного времени периода, который, как правило, один год. См финансовое моделирование",,,,,,,,,,,,,,,,,,,,,,,,,,,
,Finite element analysis," — это численный метод решения дифференциальных уравнений с частными производными, а также интегральных уравнений, возникающих при решении задач прикладной физики. Метод широко используется для решения задач механики деформируемого твёрдого тела, теплообмена, гидродинамики и электродинамики.",,,,,,,,,,,,,,,,,,,,,,,,,,,
,Full text search,"относится к методам для поиска одного компьютера сохраненный документ или коллекцию в полном текстовой базе данных. Полнотекстовый поиск отличается от поиска на основе метаданных или на частях оригинальных текстов, представленных в базах данных (таких как названия, рефераты, выбранных разделах или библиографических ссылок).",,,,,,,,,,,,,,,,,,,,,,,,,,,
,Fire protection engineering,"Пожарная техника является применение научных и инженерных принципов для защиты людей, имущества и окружающей их средой от вредных и разрушительных последствий пожара и дыма. Она охватывает инженерные противопожарной защиты, которая фокусируется на обнаружении пожара, подавления и смягчения и пожарной техники безопасности, который фокусируется на человеческом поведении и поддержание логичной среду для эвакуации от пожара.",,,,,,,,,,,,,,,,,,,,,,,,,,,
,Financial prospectus,"является документом раскрытие который описывает финансовую безопасность для потенциальных покупателей. Это обычно предоставляет инвесторам существенной информации о взаимных фондов, акции, облигации и другие инвестиции, такие как описание бизнеса компании, финансовой отчетности, биографии должностных лиц и директоров, подробная информация об их компенсации, любой судебный процесс, который проходит, А список свойств материалов и любой другой существенной информации. ",,,,,,,,,,,,,,,,,,,,,,,,,,,
,.NET Compact Framework," — это версия .NET Framework, которая разработана для запуска приложений на устройствах, основанных на платформе Windows CE, таких как PDA, мобильные телефоны, заводские контроллеры и других. .NET Compact Framework использует библиотеки, подобные полной версии .NET Framework, вместе с тем имеются специальные наборы библиотек для мобильных устройств, например, Windows CE InputPanel.",,,,,,,,,,,,,,,,,,,,,,,,,,,
,Adobe Flash,"или просто Flash (/flæʃ/), по-русски часто пишут флеш или флэш) — мультимедийная платформа компании Adobe Systems для создания веб-приложений или мультимедийных презентаций. Широко используется для создания рекламных баннеров, анимации, игр, а также воспроизведения на веб-страницах видео- и аудиозаписей.",,,,,,,,,,,,,,,,,,,,,,,,,,,
,Apache Flex, — комплект средств разработки (SDK) для создания кросс-платформенных Rich Internet Applications на основе Flash,,,,,,,,,,,,,,,,,,,,,,,,,,,
,Adobe FrameMaker," — настольная издательская система, основанная на структурированной разметке документа (см.SGML, HTML, XML), в отличие от систем, основанных на подобном верстаку графическом интерфейсе (GUI).",,,,,,,,,,,,,,,,,,,,,,,,,,,
,Collaborative filtering,"— это один из методов построения прогнозов (рекомендаций) врекомендательных системах[⇨], использующий известные предпочтения (оценки) группы пользователей для прогнозирования неизвестных предпочтений другого пользователя",,,,,,,,,,,,,,,,,,,,,,,,,,,
,Corporate finance,"- Это денежные отношения, связанные с формированием и распределением денежных доходов и накоплений и их использования на различные цели предприятия; на выполнение обязательств перед финансово-банковской системой, финансирование расходов, выплаты дивидендо",,,,,,,,,,,,,,,,,,,,,,,,,,,
,ionic framework,"является передний конец фреймворк для разработки родные-чувствующих гибридные мобильные приложения в HTML5, используя Sass и AngularJS. По умолчанию он работает поверх Кордова, хотя вы также можете использовать PhoneGap",,,,,,,,,,,,,,,,,,,,,,,,,,,
,National Electronic Funds Transfer, является одним из самых известных систем электронного перевода средств Индии,,,,,,,,,,,,,,,,,,,,,,,,,,,
,.NET Framework,"— программная платформа, выпущенная компанией Microsoft в 2002 году. Основой платформы является общеязыковая среда исполнения Common Language Runtime (CLR), которая подходит для разных языков программирования. Функциональные возможности CLR доступны в любых языках программирования, использующих эту среду.",,,,,,,,,,,,,,,,,,,,,,,,,,,
,Git,"— распределённая система управления версиями. Проект был создан Линусом Торвальдсом для управления разработкой ядра Linux, первая версия выпущена 7 апреля 2005 года. На сегодняшний день его поддерживаетДжунио Хамано.",,,,,,,,,,,,,,,,,,,,,,,,,,,
,GAAP," — национальные стандарты бухгалтерского учёта, применяемые в каждой стране, в соответствии с национальным законодательством",,,,,,,,,,,,,,,,,,,,,,,,,,,
,GIMP,"— свободно распространяемый растровый графический редактор, программа для создания и обработки растровой графики и частичной поддержкой работы с векторной графикой. ",,,,,,,,,,,,,,,,,,,,,,,,,,,
,GLSL," — язык высокого уровня для программирования шейдеров. Синтаксис языка базируется на языке программирования ANSI C, однако, из-за его специфической направленности, из него были исключены многие возможности, для упрощения языка и повышения производительности. В язык включены дополнительные функции и типы данных, например для работы с векторами и матрицами.",,,,,,,,,,,,,,,,,,,,,,,,,,,
,Gradle," — система автоматической сборки, построенная на принципах Apache Ant и Apache Maven, но предоставляющаяDSL на языке Groovy вместо традиционной XML-образной формы представления конфигурации проекта.",,,,,,,,,,,,,,,,,,,,,,,,,,,
,GitHub," — крупнейший[4] веб-сервис для хостинга IT-проектов и их совместной разработки. Основан на системе контроля версий Git и разработан на Ruby on Rails[5] и Erlang компанией GitHub, Inc (ранее Logical Awesome).",,,,,,,,,,,,,,,,,,,,,,,,,,,
,Grails,"— программный каркас для создания веб-приложений, написанный на скриптовом языке Groovy, который в свою очередь основан на Java. Grails создан под сильным влиянием широко известного Ruby on Rails и основан на шаблоне «Модель-представление-поведение» (MVC). Grails был создан с целью привлечь интерес пользователей к платформе Javaи дать Java-разработчикам возможности для быстрого построения веб-приложений с лёгкостью и гибкостью, которая была недоступна прежде.",,,,,,,,,,,,,,,,,,,,,,,,,,,
,Groovy,"— объектно-ориентированный язык программирования, разработанный для платформы Java как дополнение к языку Java с возможностями Python, Ruby и Smalltalk.",,,,,,,,,,,,,,,,,,,,,,,,,,,
,Golang," — компилируемый, многопоточный язык программирования, разработанный компанией Google[",,,,,,,,,,,,,,,,,,,,,,,,,,,
,ggplot2,"- Графический пакет визуализации данных для языка программирования R. ggplot2 позволяет существенно расширить базовые графические возможности R. Один из самых популярных пакетов, которые свободно доступны для установки с сайта Comprehensive R Archive Netw",,,,,,,,,,,,,,,,,,,,,,,,,,,
,Grunt.js,— система сборки javascript пакетов,,,,,,,,,,,,,,,,,,,,,,,,,,,
,Gearman,"открытая среда разработки приложения источник, предназначенная для распределения соответствующих компьютерных задач на нескольких компьютерах, так что большие задачи могут быть выполнены быстрее.",,,,,,,,,,,,,,,,,,,,,,,,,,,
,Geology,"это наука о Земле, включающий в себя изучение твердой Земли, горные породы, из которых она состоит, а также процессы, с помощью которых они изменяются. Геология может также относиться в целом к изучению твердых особенностей любого небесного тела (например, геологии Луны или Марса).",,,,,,,,,,,,,,,,,,,,,,,,,,,
,Geomagic,является профессиональной разработке программного обеспечения бренд 3D Systems.,,,,,,,,,,,,,,,,,,,,,,,,,,,
,GoToMyPC,"это услуга, программное обеспечение дистанционного управления, который позволяет пользователю управлять своим компьютером с другого компьютера, через Интернет. Online Services подразделение компании Citrix Systems производит GoToMyPC.",,,,,,,,,,,,,,,,,,,,,,,,,,,
,GearTrax  ,"— GearTrax предназначен для создания моделей деталей трансмиссий, при этом объект, параметры которого определены в программе, затем формируется в SolidWorks. Контуры зубьев описываются сплайном или совокупностью окружностей, имитирующих - если необходимо - эвольвентный профиль. Полученная кинематическая пара визуализируется в окне программы с имитацией движения. При изменении управляющих параметров происходит пересчет управляемых, причем можно, базируясь на выбранном стандартном объекте, сформировать отличающуюся от стандарта деталь.",,,,,,,,,,,,,,,,,,,,,,,,,,,
,Greenplum,"— компания, занимающаяся разработкой СУБД для хранилищ данных. Компания специализируется на решениях Enterprise Data Cloud для сильно масштабированных хранилищ данных и аналитических систем.",,,,,,,,,,,,,,,,,,,,,,,,,,,
,GlassFish,"— сервер приложений с открытым исходным кодом, реализующий спецификации Java EE, изначально разработанный Sun Microsystems.",,,,,,,,,,,,,,,,,,,,,,,,,,,
,GUI,"— разновидностьпользовательского интерфейса, в котором элементы интерфейса (меню, кнопки, значки, списки и т. п.), представленные пользователю на дисплее, исполнены в видеграфических изображений.",,,,,,,,,,,,,,,,,,,,,,,,,,,
,GarageBand," — программное обеспечение для Mac OS X и устройств системы iOS для создания музыки или подкастов, разработанное Apple и являющееся частью пакета iLife.",,,,,,,,,,,,,,,,,,,,,,,,,,,
,Google Apps," — пакет облачных сервисов и приложений для совместной работы, предлагаемый компанией Google по подписке.",,,,,,,,,,,,,,,,,,,,,,,,,,,
,Google Play," — магазин приложений, игр, книг, музыки и фильмов компанииGoogle и других компаний, позволяющий владельцам устройств с операционной системой Android устанавливать и приобретать различные приложения ",,,,,,,,,,,,,,,,,,,,,,,,,,,
,Game design,— процесспроектирования содержания и правил компьютерных игр (геймплея).,,,,,,,,,,,,,,,,,,,,,,,,,,,
,GetResponse,"является поставщиком услуг электронной почты маркетинга, специализирующаяся на интернет-решений, а также создание целевых страниц.",,,,,,,,,,,,,,,,,,,,,,,,,,,
,Google+ ," — социальная сеть от компании Google. Сервис предоставляет возможность общения через Интернет с помощью специальных компонентов: Круги, Темы, ВидеоВстречи, Мобильная версия. ",,,,,,,,,,,,,,,,,,,,,,,,,,,
,Google Docs,"— бесплатный онлайн-офис, включающий в себя текстовый, табличный процессори сервис для создания презентаций, а также интернет-сервис облачного хранения файлов с функциями файлообмена[1], разрабатываемый компанией Google. ",,,,,,,,,,,,,,,,,,,,,,,,,,,
,Gamification,"— применение подходов, характерных для компьютерных игр впрограммных инструментах для неигровых процессов с целью привлечения пользователей и потребителей, повышения их вовлечённости в решение прикладных задач, использование продуктов, услуг",,,,,,,,,,,,,,,,,,,,,,,,,,,
,Game testing,"подмножество разработки игр, представляет собой процесс тестирования программного обеспечения для контроля качества видеоигр",,,,,,,,,,,,,,,,,,,,,,,,,,,
,Google Swiffy,"представляет собой инструмент веб-разработанный Google, который преобразует SWF файлы в HTML5. Его главная цель состоит в том, чтобы отобразить содержимое флэш-устройств, которые не поддерживают флэш, таких как iPhone, IPad и Android таблетки.",,,,,,,,,,,,,,,,,,,,,,,,,,,
,Gravity Forms,"является популярным WordPress плагин, который позволяет управлять формами веб-сайта, а также представления, поступающие через из этих форм. Материалы также могут быть экспортированы в Excel для использования в программном обеспечении рассылки и т.д.",,,,,,,,,,,,,,,,,,,,,,,,,,,
,Grant writing,"относится к практике завершения процесса заявки на финансирование предоставляемых учреждением, таким как государственный департамент, корпорации, фонда или траста. Такие прикладные процессы часто называются либо «грантовых предложений» или «представлений»",,,,,,,,,,,,,,,,,,,,,,,,,,,
,Google adwords," — сервис контекстной, в основном, поисковой рекламы от компании Google, предоставляющий удобныйинтерфейс и множество инструментов для создания эффективных рекламных сообщений",,,,,,,,,,,,,,,,,,,,,,,,,,,
,Graphic design,— художественно-проектная деятельность по созданию гармоничной и эффективной визуально-коммуникативной среды.,,,,,,,,,,,,,,,,,,,,,,,,,,,
,Google AdSense," — сервис контекстной рекламы от Google. Программа автоматически размещает на веб-сайтах текстовыеи графические объявления, подходящие по контексту.",,,,,,,,,,,,,,,,,,,,,,,,,,,
,Google Web Toolkit (GWT,"— свободный Java-фреймворк, который позволяет веб-разработчикам создавать Ajax-приложения. Его особенность - это компилятор Java -> JavaScript, позволяющий почти всю разработку клиента и сервера реализовать на основе Java и лишь на последнем этапе создать соответствующие JavaScript, HTML и CSS. ",,,,,,,,,,,,,,,,,,,,,,,,,,,
,Graph database, — разновидность баз данных с реализацией сетевой модели в виде графа и его обобщений.,,,,,,,,,,,,,,,,,,,,,,,,,,,
,GTK+,"— кроссплатформенная библиотека элементов интерфейса, имеет простой в использовании API, наряду с Qt является одной из двух наиболее популярных на сегодняшний день библиотек для X Window System.",,,,,,,,,,,,,,,,,,,,,,,,,,,
,Google SketchUp,"— программа для моделирования относительно простых трёхмерных объектов — строений, мебели, интерьера",,,,,,,,,,,,,,,,,,,,,,,,,,,
,Gps,"— спутниковая система навигации, обеспечивающая измерение расстояния, времени и определяющая местоположение во всемирной системе координат WGS 84.",,,,,,,,,,,,,,,,,,,,,,,,,,,
,Google Search,"Google Search, обычно упоминается как веб-поиска Google или Google, это веб-поисковик принадлежащий Google Inc.",,,,,,,,,,,,,,,,,,,,,,,,,,,
,Google Analytics ,"— бесплатный сервис, предоставляемый Google для создания детальной статистикипосетителей веб-сайтов. Статистика собирается на сервере Google, пользователь только размещает JS-код на страницах своего сайта.",,,,,,,,,,,,,,,,,,,,,,,,,,,
,Game development, — процесс создания компьютерных игр (видеоигр).,,,,,,,,,,,,,,,,,,,,,,,,,,,
,Google Map Maker," — картографический сервис от Google, запущенный в июне 2008 года[1], цель которого, в отличие от Google Maps — дать возможность пользователям самим доделать картографическую информацию, отсутствующую, или имеющуюся в неточном виде, на картах разных стран. ",,,,,,,,,,,,,,,,,,,,,,,,,,,
,Game programming,"подмножество разработки игр, является разработка программного обеспечения видеоигр. ",,,,,,,,,,,,,,,,,,,,,,,,,,,
,Geomagic Design X,"- это первая программа, позволяющая пользователям перейти от 3D-скана к полностью параметрической CAD-модели. Geomagic Design X позволяет быстро создавать параметрические CAD-модели по данным с 3D-сканеров.",,,,,,,,,,,,,,,,,,,,,,,,,,,
,Google App Engine," — сервис хостинга сайтов и web-приложений на серверах Google с бесплатным именем<имя_сайта>.appspot.com, либо с собственным именем, задействованным[1] с помощью служб Google",,,,,,,,,,,,,,,,,,,,,,,,,,,
