,DNS SEC,"— это расширение системы DNS, обеспечивающее выстраивание цепочки доверия для домена. Администратор домена, подписавший свою зону с помощью DNSSEC, предоставит посетителям своего сайта защиту от фишинга, отравления кэша и многих других интернет-угроз.",,,,,,,,,,,,,,,,,,,,,,,,,,,
,DEV OPS," — методология разработки программного обеспечения, нацеленная на активное взаимодействие и интеграцию специалистов по разработке и специалистов по информационно-технологическому обслуживанию.",,,,,,,,,,,,,,,,,,,,,,,,,,,
,DocBook,"— приложение SGML или XML (проще говоря — популярный набор тегов), предназначенное для разметки документов, такое же, как HTML для разметки веб-документов. Текущая версия DocBook V5.0 — официальный стандарт OASIS.",,,,,,,,,,,,,,,,,,,,,,,,,,,
,DirectX," — это набор API, разработанных для решения задач, связанных с программированием под Microsoft Windows. Наиболее широко используется при написании компьютерных игр.",,,,,,,,,,,,,,,,,,,,,,,,,,,
,Drawing,"является одной из форм изобразительного искусства , в которых человек использует различные инструменты для рисования, чтобы отметить бумаги или другого двумерного среду.",,,,,,,,,,,,,,,,,,,,,,,,,,,
,Debian," — операционная система, состоящая из свободного ПО с открытым исходным кодом.",,,,,,,,,,,,,,,,,,,,,,,,,,,
,DelftShip,"о представляет собой полнофункциональный программный 3D моделирования hullform прекрасно подходит для студентов, домашних пользователей или кого-либо еще с интересом в проектировании судов.",,,,,,,,,,,,,,,,,,,,,,,,,,,
,DataStage," интегрирует данные из различных систем, используя высокопроизводительную платформу параллельных вычислений, и поддерживает расширенное управление метаданными и корпоративное взаимодействие. ",,,,,,,,,,,,,,,,,,,,,,,,,,,
,D,"— мультипарадигмальный компилируемый язык программирования, созданный Уолтером Брайтом из компанииDigital Mars.",,,,,,,,,,,,,,,,,,,,,,,,,,,
,DotNetNuke,"— это система управления контентом сайта (англ. Content management system, CMS), предназначенная для создания, внедрения и управления коммерческими или некоммерческими веб-сайтами и порталами",,,,,,,,,,,,,,,,,,,,,,,,,,,
,Demandware,"Это достаточно популярная в мире платформа, предназначенная исключительно для обслуживания крупного e-commerce.",,,,,,,,,,,,,,,,,,,,,,,,,,,
,Dwolla," Dwolla в позволяет отправлять деньги, получать данные о транзакции, запросить деньги, добавить банковские счета, прием платежей, и в целом гораздо больше.",,,,,,,,,,,,,,,,,,,,,,,,,,,
,DevExpress,"— это платный плагин для Visual Studio, относящийся к классу productivity tools, который позволяет разработчику быстрее писать более качественный код, отлаживать его, запускать тесты, обнаруживать дефекты и выполнять …",,,,,,,,,,,,,,,,,,,,,,,,,,,
,DirectShow,"— мультимедийный фреймворк и интерфейс программирования приложений(API), выпущенный корпорацией Microsoft для разработчиков программного обеспечения и позволяющий Windows-приложениям управлять широким спектром устройств аудио/видео ввода-вывода, включая DV- и веб-камеры, DVD-устройства, ТВ-тюнеры и др.",,,,,,,,,,,,,,,,,,,,,,,,,,,
,BACKUP,Создает резервную копию всей базы данных SQL Server (чтобы получить резервную копию базы данных) либо файлов или файловых групп базы данных (чтобы получить резервную копию файлов (BACKUP DATABASE,,,,,,,,,,,,,,,,,,,,,,,,,,,
,Dropbox API,"представляет собой целый набор инструментов для обеспечения безопасности и соответствия стандартам, а также административные решения, включая обнаружение электронных данных (eDiscovery), предотвращение потери данных (DLP), информацию о безопасности и управление событиями (SIEM). Кроме того, на базе API можно развивать новые приложения.",,,,,,,,,,,,,,,,,,,,,,,,,,,
,Data Mining,"— собирательное название, используемое для обозначения совокупности методов обнаружения в данных ранее неизвестных, нетривиальных, практически полезных и доступных интерпретации знаний, необходимых для принятия решений в различных сферах человеческой деятельности.",,,,,,,,,,,,,,,,,,,,,,,,,,,
,Data Science," — раздел информатики, изучающий проблемы анализа, обработки и представления данных в цифровой форме. Объединяет методы по обработке данных в условиях больших объёмов и высокого уровня параллелизма, статистические методы, методыинтеллектуального анализа данных и приложения искусственного интеллекта для работы с данными, а также методы проектирования и разработки баз данных.",,,,,,,,,,,,,,,,,,,,,,,,,,,
,DOS," — семейство операционных систем для персональных компьютеров, ориентированных на использование дисковых накопителей, таких как жёсткий диск идискета.",,,,,,,,,,,,,,,,,,,,,,,,,,,
,Dropshipping," – это метод ведения бизнеса (вид партнерской программы), при котором производитель товара доверяет реализацию своего товара посреднику – дропшипперу. Посредник находит покупателей товара и принимает от них оплату.",,,,,,,,,,,,,,,,,,,,,,,,,,,
,Digital Ocean,"Простой облачный хостинг, построенный для разработчиков.",,,,,,,,,,,,,,,,,,,,,,,,,,,
,Raise Data Recovery,"предназначены для самостоятельного восстановления данных непрофессионалами. Существует множество версий, каждая из которых ограничена поддержкой единственного семейства файловых систем.",,,,,,,,,,,,,,,,,,,,,,,,,,,
,Data analysis," — серия подходов, инструментов и методов обработки структурированных и неструктурированных данных огромных объёмов и значительного многообразия для получения воспринимаемых человеком результатов, эффективных в условиях непрерывного прироста, распределения по многочисленным узлам вычислительной сети",,,,,,,,,,,,,,,,,,,,,,,,,,,
,Data modeling," — это абстрактное, самодостаточное, логическое определение объектов, операторов и прочих элементов, в совокупности составляющих абстрактную машину доступа к данным, с которой взаимодействует пользователь.",,,,,,,,,,,,,,,,,,,,,,,,,,,
,Data scraping,— это технология получения данных из веб-страниц.,,,,,,,,,,,,,,,,,,,,,,,,,,,
,Data cleansing," — процесс выявления и исправления ошибок, несоответствий данных с целью улучшения их качества. Очистка данных является составной частью интеллектуального анализа данных.",,,,,,,,,,,,,,,,,,,,,,,,,,,
,DVD Studio Pro,,,,,,,,,,,,,,,,,,,,,,,,,,,,
,Data Structures,"— программная единица, позволяющая хранить и обрабатывать множество однотипных и/или логически связанных данных в вычислительной технике. Для добавления, поиска, изменения и удаления данных структура данных предоставляет некоторый набор функций, составляющих её интерфейс.",,,,,,,,,,,,,,,,,,,,,,,,,,,
,Data Protection,"— это программный продукт компании Microsoft, обеспечивающий непрерывную защиту данных для надежного восстановления работы серверов Windows. Является частью семейства продуктов Microsoft System Center.",,,,,,,,,,,,,,,,,,,,,,,,,,,
,Desktop,"— это файл конфигурации, который содержит данные настроек внешнего вида системной папки в ОС Microsoft Windows: значок, цвет текста, фоновый рисунок и т. д. Файл desktop.ini, как и любой .ini-файл, структурно разделен на секции.",,,,,,,,,,,,,,,,,,,,,,,,,,,
,Defect Tracking," — прикладная программа, разработанная с целью помочь разработчикам программного обеспечения(программистам, тестировщикам и др.) учитывать и контролировать ошибки и неполадки, найденные в программах, пожелания пользователей, а также следить за процессом устранения этих ошибок и выполнения или невыполнения пожеланий.",,,,,,,,,,,,,,,,,,,,,,,,,,,
,DataLife Engin,"многопользовательский новостной движок предназначенный для организации собственных СМИ в интернете. Благодаря мощной системе публикации, настройки и редактирования новостей, движок на шаг вперед опережает своих ближайших конкурентов.",,,,,,,,,,,,,,,,,,,,,,,,,,,
,Database design,"это процесс получения подробного модель данных в базе данных. Эта логическая модель данных содержит все необходимые логические и физические проектные решения и параметры физического хранения необходимых для создания дизайна в определении данных языка, которые затем могут быть использованы для создания базы данных.",,,,,,,,,,,,,,,,,,,,,,,,,,,
,Digital mapping ,"это процесс, посредством которого сбор данных составляется и отформатирован в виртуальный образ. Основная функция этой технологии является создание карты, которые дают точные представления конкретной области, в котором подробно главных дорожных артерий и других точек интереса.",,,,,,,,,,,,,,,,,,,,,,,,,,,
,Document review,"это процесс, посредством каждая сторона в случае сортирует и анализирует документы и данные, которые они обладают (и более поздние документы и сведения, предоставленные их противников через открытие), чтобы определить которые чувствительны или иным отношение к делу. Изучение документов является ценным основной продукт типа работы, выполняемой адвокатами для своих клиентов, хотя это все чаще работа должна быть выполнена с помощью поверенных обзора специализированных документов",,,,,,,,,,,,,,,,,,,,,,,,,,,
,Direct marketing," – это форма рекламы, отрицающая любые каналы передачи информации, кроме направленного прямо на конечного потребителя. Иными словами, когда коммерческая или некоммерческая организация обращается напрямую к потребителю как индивидууму, минуя посредников, то это – прямой маркетинг.",,,,,,,,,,,,,,,,,,,,,,,,,,,
,Digital painting,"— создание электронных изображений, осуществляемое не путём рендеринга компьютерных моделей, а за счёт использования человеком компьютерных имитаций традиционных инструментов художника",,,,,,,,,,,,,,,,,,,,,,,,,,,
,Domain migration,– это удобное приложение для управления миграцией и консолидацией доменов Microsoft Windows. ,,,,,,,,,,,,,,,,,,,,,,,,,,,
,Database caching,— это сохранение некоторой переменной PHP в кэше и последующее её извлечение оттуда. ,,,,,,,,,,,,,,,,,,,,,,,,,,,
,Document control," — компьютерная система (или набор компьютерных программ), используемая для отслеживания и хранения электронных документов и/или образов (изображений и иных артефактов) бумажных документов.",,,,,,,,,,,,,,,,,,,,,,,,,,,
,DaVinci Resolve ,"это комплексное решение для нелинейного редактирования и грейдинга,которое позволяет монтаж,установку цвета,окончательную обработку и создание конечного продукта в одном приложении.","— это комплексное решение для нелинейного редактирования и грейдинга, которое позволяет выполнять монтаж, установку цвета, окончательную обработку и создание конечного продукта в одном приложении",,,,,,,,,,,,,,,,,,,,,,,,,,
,Data Warehouse,"предметно-ориентированная информационная база данных, специально разработанная и предназначенная для подготовки отчётов и бизнес-анализа с целью поддержки принятия решений в организации.",,,,,,,,,,,,,,,,,,,,,,,,,,,
,Database testing,,,,,,,,,,,,,,,,,,,,,,,,,,,,
,Django Framework,"— свободный программный каркас для веб-приложений на языке Python, использующий шаблон проектирования MVC",,,,,,,,,,,,,,,,,,,,,,,,,,,
,Data sufficiency,,,,,,,,,,,,,,,,,,,,,,,,,,,,
,dBase,"— семейство широко распространённых систем управления базами данных, а также язык программирования, используемый в них.",,,,,,,,,,,,,,,,,,,,,,,,,,,
,Database  modeling,"— модель данных, позволяющая описывать концептуальные схемы предметной области.",,,,,,,,,,,,,,,,,,,,,,,,,,,
,Dijital sculpting,"— вид изобразительного искусства, произведения которого имеют объёмную форму и выполняются с помощью специального программного обеспечения, посредством инструментов которого возможно производить различного рода манипуляции над 3d моделями, как если бы скульптор работал над обычной глиной или камнем.",,,,,,,,,,,,,,,,,,,,,,,,,,,
,Dental,"— раздел медицины, занимающийся изучением зубов, их строения и функционирования, их заболеваний, методов их профилактики и лечения, а также болезней полости рта, челюстей и пограничных областей лица и шеи",,,,,,,,,,,,,,,,,,,,,,,,,,,
,Disaster recovery,"включает в себя набор политик и процедур, позволяющих восстановление или продолжение жизненной технологической инфраструктуры и систем после стихийного или антропогенного бедствия.",,,,,,,,,,,,,,,,,,,,,,,,,,,
,Datasheet,"— это совокупность элементарных звеньев объекта и связей между ними, один из видов графической модели. Под элементарным звеном понимают часть объекта, системы управления и т. д., которая реализует элементарную функцию.",,,,,,,,,,,,,,,,,,,,,,,,,,,
,Desktop publishing,"является создание документов с использованием навыков макета страницы на персональном компьютере. Настольные издательские программное обеспечение может генерировать раскладки и производить типографский текст качества и изображения, сравнимые с традиционными типографии и печати.",,,,,,,,,,,,,,,,,,,,,,,,,,,
,Distance education,"Предоставление образовательных курсов, например, телевизор, заочного обучения или электронных носителях, для студентов, которые не могут присутствовать лично учебное заведение обеспокоен",,,,,,,,,,,,,,,,,,,,,,,,,,,
,Data visualization,"Преобразование цифровых данных в изображение, доступное для восприятия человеком илиспециальным устройством.",,,,,,,,,,,,,,,,,,,,,,,,,,,
,DDK," — набор из средств разработки, заголовочных файлов, библиотек, утилит, программного кода примеров и документации, который позволяет программистам создавать драйверы для устройств по определённой технологии или для определённой платформы (программной или программно-аппаратной).",,,,,,,,,,,,,,,,,,,,,,,,,,,
,Digital photographuy,"— это электронное устройство, предназначенное для считывания и показаизображений, записанных в цифровом виде.",,,,,,,,,,,,,,,,,,,,,,,,,,,
,Digital access,усовершенствованная система связи с цифровым доступом,,,,,,,,,,,,,,,,,,,,,,,,,,,
,Database management,"Пункт меню Database Management позволяет Вам создать Новую базу данных , изменить Базу данных по умолчанию (Default), Экспортировать сдачи из базы данных и провести Переиндексацию (Fix Indexes).",,,,,,,,,,,,,,,,,,,,,,,,,,,
,DSL,"— модемная технология, в которой доступная полоса пропускания канала распределена между исходящим и входящим трафиком асимметрично. ",,,,,,,,,,,,,,,,,,,,,,,,,,,
,Email marketing,"— это один из наиболее эффективных инструментов интернет-маркетинга для бизнеса. Он позволяет выстраивать прямую коммуникацию между брендом (или бизнесом, компанией) и потенциальными или существующими клиентами.",,,,,,,,,,,,,,,,,,,,,,,,,,,
,E4X,"- Это расширение языка программирования, добавляет родную поддержку XML в ECMAScript (который включает ActionScript, DMDScript, JavaScript, JScript). Целью расширения является обеспечение альтернативного DOM интерфейса, который использует для доступа к XM",,,,,,,,,,,,,,,,,,,,,,,,,,,
,ERP,"— организационная стратегия интеграции производства и операций, управления трудовыми ресурсами, финансового менеджмента и управления активами, ориентированная на непрерывную балансировку и оптимизацию ресурсов предприятия посредством специализированного интегрированного пакета прикладного программного обеспечения, обеспечивающего общую модель данных и процессов для всех сфер деятельности",,,,,,,,,,,,,,,,,,,,,,,,,,,
,ETL,— один из основных процессов в управлении хранилищами данных,,,,,,,,,,,,,,,,,,,,,,,,,,,
,Exim,"— это агент пересылки сообщений, используемый в операционных системах семейства Unix",,,,,,,,,,,,,,,,,,,,,,,,,,,
,EDGE," — цифровая технология беспроводной передачи данных для мобильной связи, которая функционирует как надстройка над 2G и 2.5G (GPRS)-сетями. ",,,,,,,,,,,,,,,,,,,,,,,,,,,
